{
  "$schema": "https://json-schema.org/draft/2020-12/schema",
  "title": "Event",
  "description": "An immutable, append-only record of one query and its full answer, including the nested trace of pipeline Steps that produced it (ADR-0001). event_type is always \"QueryAnswered\" here — EventFlagged and AnswerOverridden are separate schemas that reference a QueryAnswered Event's id rather than ever editing it.",
  "type": "object",
  "properties": {
    "id": { "type": "string", "minLength": 1 },
    "event_type": { "const": "QueryAnswered" },
    "query": { "type": "string", "minLength": 1 },
    "answer": {
      "type": "string",
      "minLength": 1,
      "description": "The user-facing response. Fully substantive on a completed run; a refusal or not-found message when the pipeline halted early."
    },
    "flags": {
      "type": "array",
      "items": { "$ref": "#/$defs/automated_flag" },
      "description": "Every automated Flag raised while producing this Event. human_flagged is deliberately excluded from this enum: it can only ever be added after the fact via a separate EventFlagged record (ADR-0001), never present on the Event at write time. See $defs/automated_flag for which Step produces each of the remaining six and whether it halts the pipeline."
    },
    "steps": {
      "type": "array",
      "minItems": 1,
      "prefixItems": [
        {
          "allOf": [
            { "$ref": "#/$defs/step" },
            { "properties": { "step_type": { "const": "classify" } } }
          ]
        },
        {
          "allOf": [
            { "$ref": "#/$defs/step" },
            { "properties": { "step_type": { "const": "retrieve" } } }
          ]
        },
        {
          "allOf": [
            { "$ref": "#/$defs/step" },
            { "properties": { "step_type": { "const": "draft" } } }
          ]
        },
        {
          "allOf": [
            { "$ref": "#/$defs/step" },
            { "properties": { "step_type": { "const": "verify" } } }
          ]
        }
      ],
      "items": false,
      "description": "classify, retrieve, draft, verify — in that fixed order, positionally enforced (prefixItems), with no items beyond the fourth allowed (items: false). A halted pipeline stores a strict prefix (only classify, or classify+retrieve); an unhalted run stores all four, in order, and no more."
    }
  },
  "required": ["id", "event_type", "query", "answer", "flags", "steps"],
  "additionalProperties": false,
  "allOf": [
    {
      "description": "possible_prompt_injection halts at classify (ADR-0008): no Step beyond classify is ever stored.",
      "if": {
        "properties": { "flags": { "contains": { "const": "possible_prompt_injection" } } },
        "required": ["flags"]
      },
      "then": { "properties": { "steps": { "maxItems": 1 } } }
    },
    {
      "description": "no_chunks_retrieved halts at retrieve (ADR-0009): no Step beyond retrieve is ever stored.",
      "if": {
        "properties": { "flags": { "contains": { "const": "no_chunks_retrieved" } } },
        "required": ["flags"]
      },
      "then": { "properties": { "steps": { "minItems": 2, "maxItems": 2 } } }
    },
    {
      "description": "Without either halting Flag, the pipeline runs to completion: all four Steps must be present.",
      "if": {
        "properties": {
          "flags": {
            "not": {
              "anyOf": [
                { "contains": { "const": "possible_prompt_injection" } },
                { "contains": { "const": "no_chunks_retrieved" } }
              ]
            }
          }
        },
        "required": ["flags"]
      },
      "then": { "properties": { "steps": { "minItems": 4 } } }
    }
  ],
  "$defs": {
    "automated_flag": {
      "type": "string",
      "description": "The six Flags a pipeline can raise at write time. human_flagged is not one of them — see the flags property description.",
      "enum": [
        "low_confidence",
        "no_supporting_context",
        "no_chunks_retrieved",
        "pii_detected",
        "possible_prompt_injection",
        "possibly_superseded_source"
      ]
    },
    "step": {
      "type": "object",
      "properties": {
        "step_type": { "enum": ["classify", "retrieve", "draft", "verify"] },
        "model": { "type": "string", "minLength": 1 },
        "cost": { "type": "number", "minimum": 0 },
        "latency_ms": { "type": "number", "minimum": 0 },
        "retrieved_chunks": {
          "type": "array",
          "items": {
            "type": "object",
            "properties": {
              "chunk_id": { "type": "string", "minLength": 1 },
              "document_id": { "type": "string", "minLength": 1 },
              "text": {
                "type": "string",
                "minLength": 1,
                "description": "The pinned Chunk text at retrieval time, not just its id, so Replay can re-execute against exactly what was retrieved (ADR-0005)."
              },
              "score": { "type": "number" }
            },
            "required": ["chunk_id", "document_id", "text", "score"],
            "additionalProperties": false
          }
        },
        "confidence": {
          "type": "number",
          "minimum": 0,
          "maximum": 1,
          "description": "verify's groundedness score for the drafted answer against retrieved_chunks — never the drafting model's self-reported certainty."
        }
      },
      "required": ["step_type", "model", "cost", "latency_ms"],
      "additionalProperties": false,
      "allOf": [
        {
          "description": "retrieved_chunks must be present on every retrieve Step, but it may legitimately be an empty array — that's exactly what no_chunks_retrieved (ADR-0009) represents, so this deliberately does not require minItems.",
          "if": {
            "properties": { "step_type": { "const": "retrieve" } },
            "required": ["step_type"]
          },
          "then": { "required": ["retrieved_chunks"] }
        },
        {
          "if": {
            "properties": { "step_type": { "const": "verify" } },
            "required": ["step_type"]
          },
          "then": { "required": ["confidence"] }
        }
      ]
    }
  }
}
