{
  "id": "event-001",
  "event_type": "QueryAnswered",
  "query": "How much notice must a firm give before applying a fee waiver?",
  "answer": "A firm must give a minimum of 30 business days' written notice before applying a fee waiver [1].",
  "flags": [],
  "steps": [
    {
      "step_type": "classify",
      "model": "local-llama-3.1-8b",
      "cost": 0.0001,
      "latency_ms": 120
    },
    {
      "step_type": "retrieve",
      "model": "local-embedding-model",
      "cost": 0.0002,
      "latency_ms": 340,
      "retrieved_chunks": [
        {
          "chunk_id": "chunk-cpc2012-gen2-001",
          "document_id": "doc-cpc-2012",
          "text": "A regulated entity shall provide a minimum of 30 business days' written notice to the consumer in advance of applying any fee waiver.",
          "score": 0.91
        }
      ]
    },
    {
      "step_type": "draft",
      "model": "claude-sonnet-5",
      "cost": 0.012,
      "latency_ms": 850
    },
    {
      "step_type": "verify",
      "model": "local-llama-3.1-8b",
      "cost": 0.0003,
      "latency_ms": 200,
      "confidence": 0.93
    }
  ]
}
