{
  "id": "event-004",
  "event_type": "QueryAnswered",
  "query": "What does Icelandic banking law say about overdraft fees?",
  "answer": "No relevant information was found in the available regulatory documents.",
  "flags": ["no_chunks_retrieved"],
  "steps": [
    {
      "step_type": "classify",
      "model": "local-llama-3.1-8b",
      "cost": 0.0001,
      "latency_ms": 100
    },
    {
      "step_type": "retrieve",
      "model": "local-embedding-model",
      "cost": 0.0002,
      "latency_ms": 250,
      "retrieved_chunks": []
    }
  ]
}
